{
  "schema": "familiar.embodiment_verification.v1",
  "verificationId": "01JBBVERIF0009A0000000000000A",
  "question": "historical_rehydration",
  "subject": {
    "kind": "binding",
    "bindingId": "01JBBBIND0001A0000000000000A",
    "bindingDigest": "7c84d38947e632d419829cd4c94ad84f6ac333b4aeed28c75d0210c7825b5090"
  },
  "verdict": "valid",
  "reason": "ok",
  "evidence": {
    "identityDigestRecomputed": true,
    "integrityRecomputed": true,
    "lineageVerified": true,
    "bundleStatus": "present",
    "bundleComponentsChecked": [
      "identity-declaration-manifest",
      "lineage-evidence"
    ],
    "observedStatus": "active",
    "redacted": false
  },
  "checkedAt": "2026-08-30T14:02:11Z",
  "verifierId": "coven-resolver-prod",
  "policyVersion": "identity-lifecycle:1.0.0"
}
