{
  "schema": "familiar.embodiment_verification.v1",
  "verificationId": "01JBBVERIF0012A0000000000000A",
  "question": "historical_rehydration",
  "subject": {
    "kind": "binding",
    "bindingId": "01JBBBIND0002A0000000000000A",
    "bindingDigest": "2222222222222222222222222222222222222222222222222222222222222222"
  },
  "verdict": "unverifiable",
  "reason": "bundle_missing",
  "evidence": {
    "identityDigestRecomputed": false,
    "integrityRecomputed": true,
    "lineageVerified": false,
    "bundleStatus": "missing",
    "bundleComponentsChecked": [],
    "observedStatus": null,
    "redacted": false
  },
  "checkedAt": "2026-08-30T14:02:11Z",
  "verifierId": "coven-resolver-prod",
  "policyVersion": "identity-lifecycle:1.0.0"
}
